{
 "currentTurn": 12,
 "kpis": {
  "cash": {
   "value": 83485549.0,
   "previous": 75073574.0,
   "change": 8411975.0
  },
  "revenue": {
   "value": 35321715.0,
   "previous": 31913046.0,
   "change": 3408669.0
  },
  "profit": {
   "value": 8411975.0,
   "previous": 7792478.0,
   "change": 619497.0
  },
  "customers": {
   "value": 715.0,
   "previous": 646.0,
   "change": 69.0
  },
  "churnRate": {
   "value": 0.041796,
   "previous": 0.046154,
   "change": -0.004358
  },
  "marketShare": {
   "value": 0.002841,
   "previous": 0.002606,
   "change": 0.000235
  }
 },
 "market": {
  "customerSentiment": 0.714922,
  "sentimentChange": 0.036634,
  "competitorPressure": 0.521592,
  "pressureChange": -0.001778,
  "demandIndex": 1.155,
  "demandIndexNext": 1.1,
  "activeEvents": [
   {
    "type": "positive_review",
    "title": "Positive review",
    "polarity": "POSITIVE",
    "turnsLeft": 1
   }
  ]
 },
 "series": [
  {
   "turn": 0,
   "revenue": 0,
   "expensesTotal": 0,
   "variableCosts": 0,
   "fixedCosts": 0,
   "marketingCosts": 0,
   "employeeCosts": 0,
   "productCosts": 0,
   "profit": 0,
   "cash": 100000000,
   "customers": 0,
   "newCustomers": 0,
   "churnedCustomers": 0,
   "churnRate": 0.0,
   "marketShare": 0.0,
   "customerSatisfaction": 0.6,
   "competitorPressure": 0.63,
   "brandAwareness": 0.05,
   "productQuality": 0.6,
   "price": 49900,
   "marketingBudget": 0,
   "employees": 3,
   "grossMargin": null,
   "burnRate": 0,
   "runwayMonths": null,
   "cac": null,
   "ltv": null,
   "arpu": null,
   "demandIndex": 1.0
  },
  {
   "turn": 1,
   "revenue": 4050882,
   "expensesTotal": 20183016,
   "variableCosts": 819016,
   "fixedCosts": 3828000,
   "marketingCosts": 8000000,
   "employeeCosts": 7536000,
   "productCosts": 0,
   "profit": -16132134,
   "cash": 83867866,
   "customers": 82,
   "newCustomers": 82,
   "churnedCustomers": 0,
   "churnRate": 0.0,
   "marketShare": 0.000384,
   "customerSatisfaction": 0.632686,
   "competitorPressure": 0.536884,
   "brandAwareness": 0.139936,
   "productQuality": 0.597,
   "price": 49900,
   "marketingBudget": 8000000,
   "employees": 3,
   "grossMargin": 0.797818,
   "burnRate": 16132134,
   "runwayMonths": 5.2,
   "cac": 97561,
   "ltv": null,
   "arpu": 49401,
   "demandIndex": 1.35
  },
  {
   "turn": 2,
   "revenue": 9188586,
   "expensesTotal": 21621768,
   "variableCosts": 1857768,
   "fixedCosts": 3828000,
   "marketingCosts": 6700000,
   "employeeCosts": 7536000,
   "productCosts": 1700000,
   "profit": -12433182,
   "cash": 71434684,
   "customers": 186,
   "newCustomers": 107,
   "churnedCustomers": 3,
   "churnRate": 0.036585,
   "marketShare": 0.000858,
   "customerSatisfaction": 0.66309,
   "competitorPressure": 0.521823,
   "brandAwareness": 0.22395,
   "productQuality": 0.607408,
   "price": 49900,
   "marketingBudget": 6700000,
   "employees": 3,
   "grossMargin": 0.797818,
   "burnRate": 12433182,
   "runwayMonths": 5.75,
   "cac": 62617,
   "ltv": 1077289,
   "arpu": 49401,
   "demandIndex": 1.35
  },
  {
   "turn": 3,
   "revenue": 12745458,
   "expensesTotal": 19640904,
   "variableCosts": 2576904,
   "fixedCosts": 3828000,
   "marketingCosts": 5700000,
   "employeeCosts": 7536000,
   "productCosts": 0,
   "profit": -6895446,
   "cash": 64539238,
   "customers": 258,
   "newCustomers": 83,
   "churnedCustomers": 11,
   "churnRate": 0.05914,
   "marketShare": 0.001172,
   "customerSatisfaction": 0.67525,
   "competitorPressure": 0.522415,
   "brandAwareness": 0.226394,
   "productQuality": 0.604408,
   "price": 49900,
   "marketingBudget": 5700000,
   "employees": 3,
   "grossMargin": 0.797818,
   "burnRate": 6895446,
   "runwayMonths": 9.36,
   "cac": 68675,
   "ltv": 666438,
   "arpu": 49401,
   "demandIndex": 1.1
  },
  {
   "turn": 4,
   "revenue": 15215508,
   "expensesTotal": 20940304,
   "variableCosts": 3076304,
   "fixedCosts": 3828000,
   "marketingCosts": 5200000,
   "employeeCosts": 7536000,
   "productCosts": 1300000,
   "profit": -5724796,
   "cash": 58814442,
   "customers": 308,
   "newCustomers": 66,
   "churnedCustomers": 16,
   "churnRate": 0.062016,
   "marketShare": 0.001379,
   "customerSatisfaction": 0.663901,
   "competitorPressure": 0.521163,
   "brandAwareness": 0.228058,
   "productQuality": 0.611513,
   "price": 49900,
   "marketingBudget": 5200000,
   "employees": 3,
   "grossMargin": 0.797818,
   "burnRate": 5724796,
   "runwayMonths": 10.27,
   "cac": 78788,
   "ltv": 635535,
   "arpu": 49401,
   "demandIndex": 0.855
  },
  {
   "turn": 5,
   "revenue": 16944543,
   "expensesTotal": 20064084,
   "variableCosts": 3425884,
   "fixedCosts": 4402200,
   "marketingCosts": 4700000,
   "employeeCosts": 7536000,
   "productCosts": 0,
   "profit": -3119541,
   "cash": 55694901,
   "customers": 343,
   "newCustomers": 54,
   "churnedCustomers": 19,
   "churnRate": 0.061688,
   "marketShare": 0.001513,
   "customerSatisfaction": 0.65064,
   "competitorPressure": 0.524498,
   "brandAwareness": 0.228949,
   "productQuality": 0.608513,
   "price": 49900,
   "marketingBudget": 4700000,
   "employees": 3,
   "grossMargin": 0.797818,
   "burnRate": 3119541,
   "runwayMonths": 17.85,
   "cac": 87037,
   "ltv": 638906,
   "arpu": 49401,
   "demandIndex": 0.855
  },
  {
   "turn": 6,
   "revenue": 19414593,
   "expensesTotal": 21463484,
   "variableCosts": 3925284,
   "fixedCosts": 4402200,
   "marketingCosts": 4500000,
   "employeeCosts": 7536000,
   "productCosts": 1100000,
   "profit": -2048891,
   "cash": 53646010,
   "customers": 393,
   "newCustomers": 66,
   "churnedCustomers": 16,
   "churnRate": 0.046647,
   "marketShare": 0.001708,
   "customerSatisfaction": 0.673579,
   "competitorPressure": 0.523584,
   "brandAwareness": 0.229577,
   "productQuality": 0.613991,
   "price": 49900,
   "marketingBudget": 4500000,
   "employees": 3,
   "grossMargin": 0.797818,
   "burnRate": 2048891,
   "runwayMonths": 26.18,
   "cac": 68182,
   "ltv": 844916,
   "arpu": 49401,
   "demandIndex": 1.0
  },
  {
   "turn": 7,
   "revenue": 21884643,
   "expensesTotal": 20662884,
   "variableCosts": 4424684,
   "fixedCosts": 4402200,
   "marketingCosts": 4300000,
   "employeeCosts": 7536000,
   "productCosts": 0,
   "profit": 1221759,
   "cash": 54867769,
   "customers": 443,
   "newCustomers": 69,
   "churnedCustomers": 19,
   "churnRate": 0.048346,
   "marketShare": 0.001896,
   "customerSatisfaction": 0.683451,
   "competitorPressure": 0.524326,
   "brandAwareness": 0.22995,
   "productQuality": 0.610991,
   "price": 49900,
   "marketingBudget": 4300000,
   "employees": 3,
   "grossMargin": 0.797818,
   "burnRate": 0,
   "runwayMonths": null,
   "cac": 62319,
   "ltv": 815227,
   "arpu": 49401,
   "demandIndex": 1.0
  },
  {
   "turn": 8,
   "revenue": 24404094,
   "expensesTotal": 21798072,
   "variableCosts": 4934072,
   "fixedCosts": 3828000,
   "marketingCosts": 4400000,
   "employeeCosts": 7536000,
   "productCosts": 1100000,
   "profit": 2606022,
   "cash": 57473791,
   "customers": 494,
   "newCustomers": 72,
   "churnedCustomers": 21,
   "churnRate": 0.047404,
   "marketShare": 0.002083,
   "customerSatisfaction": 0.695388,
   "competitorPressure": 0.52343,
   "brandAwareness": 0.230532,
   "productQuality": 0.616416,
   "price": 49900,
   "marketingBudget": 4400000,
   "employees": 3,
   "grossMargin": 0.797818,
   "burnRate": 0,
   "runwayMonths": null,
   "cac": 61111,
   "ltv": 831427,
   "arpu": 49401,
   "demandIndex": 1.0
  },
  {
   "turn": 9,
   "revenue": 26676540,
   "expensesTotal": 21357520,
   "variableCosts": 5393520,
   "fixedCosts": 3828000,
   "marketingCosts": 4600000,
   "employeeCosts": 7536000,
   "productCosts": 0,
   "profit": 5319020,
   "cash": 62792811,
   "customers": 540,
   "newCustomers": 72,
   "churnedCustomers": 26,
   "churnRate": 0.052632,
   "marketShare": 0.002244,
   "customerSatisfaction": 0.672136,
   "competitorPressure": 0.524129,
   "brandAwareness": 0.231454,
   "productQuality": 0.613416,
   "price": 49900,
   "marketingBudget": 4600000,
   "employees": 3,
   "grossMargin": 0.797818,
   "burnRate": 0,
   "runwayMonths": null,
   "cac": 63889,
   "ltv": 748847,
   "arpu": 49401,
   "demandIndex": 0.98
  },
  {
   "turn": 10,
   "revenue": 28899585,
   "expensesTotal": 24411300,
   "variableCosts": 5842980,
   "fixedCosts": 3828000,
   "marketingCosts": 5000000,
   "employeeCosts": 8440320,
   "productCosts": 1300000,
   "profit": 4488285,
   "cash": 67281096,
   "customers": 585,
   "newCustomers": 74,
   "churnedCustomers": 29,
   "churnRate": 0.053704,
   "marketShare": 0.002395,
   "customerSatisfaction": 0.663601,
   "competitorPressure": 0.522828,
   "brandAwareness": 0.233,
   "productQuality": 0.620291,
   "price": 49900,
   "marketingBudget": 5000000,
   "employees": 3,
   "grossMargin": 0.797818,
   "burnRate": 0,
   "runwayMonths": null,
   "cac": 67568,
   "ltv": 733897,
   "arpu": 49401,
   "demandIndex": 0.855
  },
  {
   "turn": 11,
   "revenue": 31913046,
   "expensesTotal": 24120568,
   "variableCosts": 6452248,
   "fixedCosts": 3828000,
   "marketingCosts": 5400000,
   "employeeCosts": 8440320,
   "productCosts": 0,
   "profit": 7792478,
   "cash": 75073574,
   "customers": 646,
   "newCustomers": 88,
   "churnedCustomers": 27,
   "churnRate": 0.046154,
   "marketShare": 0.002606,
   "customerSatisfaction": 0.678288,
   "competitorPressure": 0.52337,
   "brandAwareness": 0.235165,
   "productQuality": 0.617291,
   "price": 49900,
   "marketingBudget": 5400000,
   "employees": 3,
   "grossMargin": 0.797818,
   "burnRate": 0,
   "runwayMonths": null,
   "cac": 61364,
   "ltv": 853948,
   "arpu": 49401,
   "demandIndex": 1.08
  },
  {
   "turn": 12,
   "revenue": 35321715,
   "expensesTotal": 26909740,
   "variableCosts": 7141420,
   "fixedCosts": 3828000,
   "marketingCosts": 6000000,
   "employeeCosts": 8440320,
   "productCosts": 1500000,
   "profit": 8411975,
   "cash": 83485549,
   "customers": 715,
   "newCustomers": 96,
   "churnedCustomers": 27,